{
  "schema_version": "1.0.0",
  "signature_id": "osig-20261001T000000000Z-00000000",
  "manifest_digest": "sha256:0000000000000000000000000000000000000000000000000000000000000000",
  "algorithm": "none",
  "signer_identity": "UNSIGNED",
  "signature_base64": "",
  "signed_utc": null,
  "verification_status": "UNSIGNED"
}
